{
 "$schema": "https://json-schema.org/draft/2020-12/schema",
 "title": "radiation.model_research_record/0.2",
 "description": "Candidate C record (5710 hardening per the Atlas review): one EXACT model x surface x region observation set. 0.2 changes: typed evidence objects (tier/source_id/url/retrieved_on/claim — free-text tiers like '[OOPS]' are structurally impossible); exact_model_id is nullable and reserved for VERIFIED provider tokens, unverified candidates carry candidate_model_label (allOf if/then, executed); the checker binds dates to real calendar days, enforces the documented 90-day review window, resolves every source_id against the typed register, and binds filenames. Research layer only (non-boot): an entry grants no tool, effect, identity, privacy guarantee, or legal conclusion. Executed by scripts/model_research_check.py via the ONE schema executor (check 40 keeps every keyword executed).",
 "type": "object",
 "required": ["schema_name", "provider", "family", "exact_model_id", "exact_id_verified",
              "surface", "region", "status", "retrieved_on", "review_after",
              "context_window", "knowledge_cutoff", "modalities", "reasoning_effort",
              "tools", "retention_training_mode", "license_aup", "declarations",
              "safety_evidence", "independent_evidence", "local_observations",
              "known_gaps", "documentation_completeness", "confidence", "aliases",
              "dated_ids"],
 "additionalProperties": false,
 "properties": {
  "schema_name": {"const": "radiation.model_research_record/0.2"},
  "provider": {"type": "string", "minLength": 2, "maxLength": 40},
  "family": {"type": "string", "minLength": 2, "maxLength": 60},
  "exact_model_id": {
    "anyOf": [{"type": "string", "pattern": "^[A-Za-z0-9._:-]{2,80}$"}, {"type": "null"}],
    "description": "the provider's own id token — reserved for VERIFIED ids only (exact_id_verified true); null while the exact string is uncaptured"},
  "exact_id_verified": {"type": "boolean",
    "description": "true ONLY if the exact id string was read from an official surface on retrieved_on; strict boolean"},
  "candidate_model_label": {"type": "string", "minLength": 4, "maxLength": 100,
    "description": "REQUIRED while exact_id_verified is false: the working label, never presented as a provider token"},
  "surface": {"enum": ["api", "consumer_app", "enterprise", "cloud_managed", "comparison_host"]},
  "region": {"type": "string", "minLength": 2, "maxLength": 40,
    "description": "endpoint region; use \"undeclared\" when no source pins one — never guess"},
  "status": {"enum": ["confirmed", "provisional", "unverified", "retired"]},
  "retrieved_on": {"type": "string", "pattern": "^\\d{4}-\\d{2}-\\d{2}$",
    "description": "ISO calendar date; the checker validates the day exists (pattern alone is not a date)"},
  "review_after": {"type": "string", "pattern": "^\\d{4}-\\d{2}-\\d{2}$",
    "description": "re-review deadline; checker enforces retrieved_on <= review_after <= retrieved_on + 90 days (the documented review window)"},
  "context_window": {"type": "string", "minLength": 2, "maxLength": 80},
  "knowledge_cutoff": {"type": "string", "minLength": 2, "maxLength": 80},
  "modalities": {"type": "array", "minItems": 1, "maxItems": 12,
    "items": {"type": "string", "minLength": 2, "maxLength": 40}},
  "reasoning_effort": {"type": "string", "minLength": 2, "maxLength": 120},
  "tools": {"type": "array", "minItems": 1, "maxItems": 12,
    "items": {"type": "string", "minLength": 2, "maxLength": 60}},
  "retention_training_mode": {"type": "string", "minLength": 4, "maxLength": 400,
    "description": "surface-specific retention/training facts only; never a privacy guarantee"},
  "license_aup": {"type": "string", "minLength": 4, "maxLength": 400,
    "description": "license/AUP pointers and open questions; never a legal conclusion"},
  "declarations": {"type": "array", "minItems": 1, "maxItems": 12,
    "items": {
      "type": "object",
      "required": ["tier", "source_id", "url", "retrieved_on", "claim"],
      "additionalProperties": false,
      "properties": {
        "tier": {"enum": ["O", "S", "U"],
          "description": "O=official provider surface, S=secondary, U=user report — an enum, not a substring convention"},
        "source_id": {"type": "string", "pattern": "^[OSU][0-9]{1,3}$",
          "description": "must resolve to a row in catalogs/model_research/sources/REGISTER.json with the SAME tier (checker-bound)"},
        "url": {"type": "string", "minLength": 4, "maxLength": 300},
        "retrieved_on": {"type": "string", "pattern": "^\\d{4}-\\d{2}-\\d{2}$"},
        "claim": {"type": "string", "minLength": 4, "maxLength": 300}
      }
    },
    "description": "claims as TYPED evidence, each bound to the register by source_id + tier"},
  "safety_evidence": {"type": "array", "minItems": 0, "maxItems": 12,
    "items": {
      "type": "object",
      "required": ["tier", "source_id", "url", "retrieved_on", "claim"],
      "additionalProperties": false,
      "properties": {
        "tier": {"enum": ["O", "S", "U"]},
        "source_id": {"type": "string", "pattern": "^[OSU][0-9]{1,3}$"},
        "url": {"type": "string", "minLength": 4, "maxLength": 300},
        "retrieved_on": {"type": "string", "pattern": "^\\d{4}-\\d{2}-\\d{2}$"},
        "claim": {"type": "string", "minLength": 4, "maxLength": 300}
      }
    }},
  "independent_evidence": {"type": "array", "minItems": 0, "maxItems": 12,
    "items": {
      "type": "object",
      "required": ["tier", "source_id", "url", "retrieved_on", "claim"],
      "additionalProperties": false,
      "properties": {
        "tier": {"enum": ["O", "S", "U"]},
        "source_id": {"type": "string", "pattern": "^[OSU][0-9]{1,3}$"},
        "url": {"type": "string", "minLength": 4, "maxLength": 300},
        "retrieved_on": {"type": "string", "pattern": "^\\d{4}-\\d{2}-\\d{2}$"},
        "claim": {"type": "string", "minLength": 4, "maxLength": 300}
      }
    }},
  "local_observations": {"type": "array", "minItems": 0, "maxItems": 12,
    "items": {"type": "string", "minLength": 2, "maxLength": 400},
    "description": "RADIATION-local observations only; session-contingent, never generalized"},
  "known_gaps": {"type": "array", "minItems": 1, "maxItems": 12,
    "items": {"type": "string", "minLength": 2, "maxLength": 300}},
  "documentation_completeness": {"type": "string", "minLength": 2, "maxLength": 200},
  "confidence": {"enum": ["low", "medium", "high"]},
  "aliases": {"type": "array", "minItems": 0, "maxItems": 12,
    "items": {"type": "string", "minLength": 1, "maxLength": 80}},
  "dated_ids": {"type": "array", "minItems": 0, "maxItems": 12,
    "items": {"type": "string", "minLength": 1, "maxLength": 80}}
 },
 "allOf": [
  {"if": {"properties": {"exact_id_verified": {"const": true}}},
   "then": {"properties": {"exact_model_id": {"type": "string"}}}},
  {"if": {"properties": {"exact_id_verified": {"const": false}}},
   "then": {"properties": {"exact_model_id": {"type": "null"},
                            "candidate_model_label": {"type": "string"}},
             "required": ["candidate_model_label"]}}
 ]
}
